title,content,link
"지구를 휩쓴 5번의 대멸종, 그리고 다가오는 6번째…[김정욱의 별별이야기-빅히스토리](64)","■35억년전 탄생한 생명체···진화를 거듭해 오늘에 이르러 ■그 동안 5번의 대멸종 일어나···모두 자연현상에 의한 것 ■전문가들 “6번째 대멸종 다가온다” 경고···인류가 원인 [서울경제] 지난 63회 기사까지 우주과학과 천문학에 대한 내용을 다뤄왔던 ‘김정욱의 별별이야기’가 확장돼 ‘빅히스토리’로 이어갑니다. ‘빅히스토리’에서는 우주 뿐 아니라 지구 생명의 탄생과 진화, 인류의 역사와 종교·철학 등 우주 그리고 지구에서 일어난 일들을 다룹니다. 우리가 평소에 궁금해 했던 여러 이야기를 어린이부터 성인까지 누구나 쉽게 이해할 수 있도록 풀어가려 합니다. 이미지투데이 45억년 탄생한 지구. 우리가 사는 이곳은 다른 천체들에 비해 매우 특별한 곳인데요, 바로 생명체가 살고 있기 때문이죠. 이 광활한 우주에 수 없이 많은 별과 행성, 위성 등 천체가 있는 점을 감안하면 지구 외 다른 곳에도 생명체가 있을 것이라는 게 과학계 중론이긴 한데 현재까지 우리가 알고 있는 한 생명체가 거주하는 곳은 지구가 유일합니다. 지구에 생명체가 생겨난 것은 지구가 탄생한 뒤 10억년 후인 지금으로부터 35억년 전입니다. 어떤 계기로 지구에 생명체가 탄생했는지 아직 밝혀지지는 않았지만 미생물로 시작된 생명체는 진화를 거듭해 현재 우리 인간을 비롯한 다양한 동·식물에 이르렀죠. 현재 지구는 다양한 종의 많은 생명체가 번성해 있는 행성이지만 이 생명체들이 오늘날까지 오기까지는 그리 순탄하지는 않았습니다. 지구에서는 그 동안 5번의 대멸종 사건이 있었는데 지구의 생물은 5번의 리셋(reset)을 한 셈입니다. 대멸종이라 불리는 사건에는 △75% 이상의 식물·동물종이 멸종 △특정 생물군이 아닌 여러 생물군에서 멸종 현상이 나타남 △멸종은 지구 모든 지역에서 일어난 현상이었음 △상대적으로 매우 짧은 시간에 멸종이 발생 △한 가지 혹은 연관된 일련의 사건에 의해 멸종 현상이 일어남 이라는 공통점이 있습니다. 1차 대멸종은 고생대 오르도비스기와 실루리아기 경계시기였던 약 4억4500만년 전에 일어났습니다. 이때 해양생물이 80%가 멸종했습니다. 세부적으로는 해양 무척추 동물의 100여 과(科·family)가 사려졌고 이끼·벌레인 완족류·태선류의 3분의 2가 자취를 감췄죠. 또 삼엽충, 필석류, 극피 동물 그리고 코노돈트의 멸종 현상도 일어났습니다. 이 시기의 지층에서 빙하기의 흔적이 다수 발견되기 때문에 멸종의 원인은 장기간의 빙하기인 것으로 추정됩니다. 2차 대멸종은 3억7000만년에 일어났습니다. 이때는 고생대 데본기와 석탄기 경계 시기입니다. 당시에는 한순간 멸종이 발생한 게 아니라 긴 기간을 두고 생물들이 사라졌습니다. 2차 대멸종 시기의 상황을 보면 산소량이 감소하면서 탄소가 증가했는데 어떤 이유로 이런 변화가 일어났는지에 대해서는 학자들 사이에서 의견이 분분합니다. 그 중에서도 가장 지지를 받는 가설이 초신성의 영향설입니다. 초신성이란 에너지가 큰 별의 폭발을 말합니다. 이미지투데이 3차 대멸종은 약 2억5100만년 전인 고생대 페름기와 중생대 트라이아스기 경계 시기에 발생했습니다. 수백만년 동안 시베리아에 쌓인 탄소가 100만년에 걸친 화산활동을 통해서 이산화탄소로 뿜어져 나왔죠. 과도한 탄소의 배출은 온실효과를 만들어 지구의 온도를 섭씨 6도나 높였고 화산에서 나온 유독성 기체는 오존층을 지속적으로 파괴했습니다. 이에 광합성하는 식물들이 죽어 산소농도가 급격히 줄어들었고, 그 식물을 먹어야 하는 육상 동물들도 죽음을 피할 수 없게 돼 결국 지구상에 생물 대부분이 멸종했습니다. 약 2억500만년 전에는 4차 대멸종이 일어났습니다. 이때는 중생대 트라이아스기와 중생대 쥐라기 경계 시기입니다. 해양에서는 원시 어류로 추정되는 암모나이트를 비롯한 연체동물의 쇠퇴 등이 있었습니다. 육상에서는 거대한 초기 양서류, 포유류의 조상인 테랍시드(수궁류)를 제외한 시냅시드(단궁류)와 공룡과 익룡 및 악어를 제외한 대부분의 육상 지배 생물이 역사의 뒤안길로 사라졌습니다. 이 멸종 사건에 의해 공룡의 경쟁자로서 육상을 지배하던 파충류도 사라지게 됩니다. 이때는 대륙들의 분열로 인한 화산활동이 많아 이산화탄소의 증가로 산소량이 매우 부족했습니다. 과학자들은 4차 대멸종의 원인을 활발한 화산폭발로 인한 산소부족으로 보고 있습니다. 5차 대멸종은 중생대 백악기와 신생대 제3기 경계 때였던 약 6500만년 전에 일어났습니다. 이때가 바로 공룡이 사라진 시기입니다. 고생물학자들은 5차 대멸종의 원인에 대해서 오랫동안 연구해왔는데 소행성 충돌, 화산폭발, 기후변화(빙하기), 해수면의 변화 등을 꼽았습니다. 그리고 소행성 충돌에 의해 공룡을 비롯한 지구생물들 상당수가 멸종했다는 가설이 지금은 가장 지지를 받고 있습니다. 과학자들은 이제 6번째 대멸종이 다가오고 있다고 경고하는데요, 그 동안 대멸종은 지각변동이나 화산폭발, 소행성 충돌 등 자연현상이 원인이었지만 6차 대멸종은 인간에 의한 것이라고 합니다. 이전 대멸종에서는 자연현상에 의한 기후변화로 지구 온난화나 빙하기가 오래 지속됐는데, 현재는 온실가스 등 인간에 의해 지구 온난화가 빠르게 진행되고 있다는 것을 우리는 잘 알고 있죠. 21세기 들어 지구상에서 멸종한 생물은 20종 가까이에 이르고, 환경부는 이대로 가면 국내에서만 21세기 말 350종 이상의 생물이 사라질 것이라고 경고했습니다. 6번째 대멸종은 인간에 의한 것이기에 우리가 지금 무얼 하고 있는지 되돌아 봐야 할 것입니다. 그리고 다행히도 인간은 대멸종을 예측·인지하고 이를 대비할 수 있는 유일한 생물종입니다. 결국 6차 대멸종은 우리에 의해서 일어나거나 우리의 노력에 의해 막을 수 있습니다.",https://n.news.naver.com/mnews/article/011/0004292694?sid=102
[뉴스초점] 온난화가 만든 북극 한파…서울 체감 -14도 강추위,"<출연: 김동혁 기상전문기자> 오늘(25일)도 영하 10도를 밑도는 강한 추위가 기승을 부리고 있습니다. 강원 산간의 체감온도는 영하 30도를 밑돌았습니다. 서해안 지역으로는 이번 주 내내 폭설이 쏟아지기도 했는데요. 자세한 한파와 대설 상황을 김동혁 기상전문기자와 알아보겠습니다. <질문 1> 이번 주 내내 한파가 계속되는 것 같습니다. 한파 특보가 여전한 가운데, 체감온도가 영하 30도를 밑돌기도 했다고요? <질문 2> 이번 한파는 특히 찬 바람이 매섭게 불어서 위력이 더 강하게 느껴지는데요. 체감온도가 영하 30도를 밑도는 지역도 있다고요? <질문 3> 한겨울에 한파가 오는 것이 당연하지만, 과거에도 기온이 영하 20도를 밑돌고 체감온도가 영하 30도까지 떨어질 때가 있었는지 궁금한데요. 지금의 한겨울 추위가 예년과 비교해서 어느 정도라고 볼 수 있나요? <질문 4> 지구 온난화 현상으로 전 세계적으로 기온이 매년 최고치를 경신하고 있는데요. 겨울철에는 왜 이렇게 매서운 한파가 나타나는 건가요? <질문 5> 온난화로 여름철이 크게 더워지고 계절 길이도 늘어나고 있습니다. 반대로 추운 가을과 겨울은 계절이 짧아졌을 것 같은데요. 온난화로 우리나라 겨울은 어떻게 달라지고 있나요? <질문 6> 서해안 지역으로 쏟아지던 폭설은 잦아든 것 같습니다. 앞으로의 대설 상황과 또 이번 추위 전망까지 궁금합니다. 연합뉴스TV 기사문의 및 제보 : 카톡/라인 jebo23",https://n.news.naver.com/mnews/article/422/0000641393?sid=103
[기후는 말한다] “온난화 멈춰도 2050년 알프스 빙하 34% 사라져”,"지구 온난화가 당장 멈춰도 알프스 빙하는 2050년까지 최소 3분의 1이 사라질 거란 연구 결과가 나왔습니다. 스위스 로잔대 연구팀이 알프스 빙하의 미래 변화를 연구했습니다. 2022년에 온난화가 멈춘 것으로 가정한 시나리오에서도, 기후와 빙하 시스템의 관성 탓에 얼음이 계속 녹아 2050년까지 알프스 빙하가 34% 감소할 것으로 예상됐습니다. 연구팀은 연구에 2022년까지의 데이터만 썼기 때문에 실제론 빙하가 훨씬 많이 녹을 가능성이 높다고 밝혔습니다. ■ 제보하기 ▷ 전화 : 02-781-1234, 4444 ▷ 이메일 : kbs1234@kbs.co.kr ▷ 카카오톡 : 'KBS제보' 검색, 채널 추가 ▷ 네이버, 유튜브에서 KBS뉴스를 구독해주세요!",https://n.news.naver.com/mnews/article/056/0011647722?sid=102
"""고랭지 배추밭 갈아엎고 사과 농사 지어요""…강원 10년 새 재배면적 3배↑","[기후변화가 바꾼 작물지도] 남부 지역 사과농가들, 서늘한 기후 좇아 강원도로 기온 오르자 원주민들도 배추→사과로 줄줄이 전환 ""탄소 배출 안줄이면 한반도서 온대작물 씨 마를 것"" [이데일리 윤종성 기자] 경북 의성에서 4000평 규모로 25년째 사과 농사를 짓고 있는 이철규 씨는 고심 끝에 과수원을 옮기기로 했다. 따뜻해진 날씨로 사과 생산량이 줄어든 데다, 생산된 사과의 당도·육질도 예전만 못해 가격마저 떨어지고 있는 탓이다. 지난해에는 흉작까지 겹쳐 소득이 평년 대비 50% 가까이 줄었다. 사과 재배적지를 찾아 전국 각지를 돌아다닌 그는 최근 강원도에 터를 잡기로 결정했다. 이 씨는 “강원도는 서늘한 날씨에 일교차도 커 최고의 사과 생산 여건을 갖췄다”며 “사과 농사를 계속 하려면 하루 빨리 강원도로 터전을 옮기는 것이 최선”이라고 말했다. [이데일리 김일환 기자] 지구온난화로 인한 기후 변화가 농업 판도를 바꾸고 있다. 날씨가 더워지면서 국내 대표 과일·작물들의 주산지가 남쪽에서 북쪽으로 계속 올라가고 있어서다. ‘사과=대구’, ’곶감=상주’, ‘감귤=제주’, ‘인삼=금산’ 등 전통적인 공식은 균열이 생긴 지 오래다. 주요 과일·작물 재배지의 ‘북진’(北進)은 한반도의 기온 상승으로 재배지가 소멸해가는 과정으로 해석되고 있다. 현재 수준의 온실가스 배출이 지속된다면 서늘한 기후에서 잘 자라는 사과, 배, 인삼 등 온대 작물들은 대부분 한반도에서 자취를 감추고, 그 빈 자리는 망고, 바나나, 올리브 등 아열대 작물들이 채울 것이란 전망이 나온다. 사과 농사 지으려 정선·임계·양구로 15일 통계청 국가통계포털(KOSIS)에 따르면 지난해 강원지역의 사과 재배면적은 1679㏊(헥타르)로 통계 작성 이래 최대다. ‘혹한’으로 유명한 강원도 지역의 사과 재배면적은 30년 전인 1993년에는 483ha에 불과했다. 그마저도 고랭지 배추, 감자 등에 밀려 2007년에는 114ha까지 급감했다. 하지만 기온상승 추세 속에서 강원도 지역이 사과나무 재배에 적합한 연평균 기온(8~11도)에 진입하면서 반전이 일어났다. 사과 재배면적은 서서히 넓어지더니 2013년 500ha, 2019년 1000ha를 넘어섰다. 지난해 재배 면적은 10년 전(516ha)과 비교해 3배 이상 늘었다. 권준걸 농협 강원연합사업단 과수팀장은 “사과 특성상 재배면적이 급속하게 늘어나진 않아도, 해마다 꾸준히 증가하고 있다”고 언급했다. 사과 농사를 지으려 고랭지 기후를 좇아 강원도로 전입하는 외지인들도 늘어나고 있다. 이명규 참두레농장 대표(임계사과연합회장)는 “임계면의 180여 사과 농가 중 3분 2 가량은 남쪽 지방에서 이주해 온 외지인”이라며 “정선·임계·양구 등지에 토지 매매 문의가 많다”고 설명했다. 고랭지 배추, 무우, 감자 등을 주로 재배했던 강원도 원주민들도 연작 피해 등을 계기로 품종 전환에 나서는 추세다. 강원도 삼척에서 3대째 농사를 짓고 있는 남영준 보이스팜 대표가 그렇다. 원래 고랭지 배추가 주력이던 그의 집안은 기온 상승에 맞춰 고추(2000년대 초반), 여름 딸기(2010년대 초반) 등으로 품종을 바꾼 뒤, 2015년부터는 사과를 주력으로 하고 있다. 남 대표는 “기후 등 재배 환경의 변화, 수익성 등을 고려해 사과로 대체하는 농가들이 많다”고 언급했다. 사진= 보이스팜 경북, 사과 재배면적 3년째 ↓..2만ha도 위태 반면 사과 주산지인 경북지역 농가의 고민은 깊다. 경북지역의 사과 재배면적은 2만46ha로 강원도의 12배에 달할 만큼 압도적이다. 하지만 경북 사과 재배면적은 △2021년 2만955ha △2022년 2만685ha △2023년 2만46ha 등 3년째 감소세다. 올해는 2만ha가 깨질 위기다. 최전성기였던 1993년(3만6021ha)과 비교하면 40% 이상 재배면적이 줄었다. 2010년 경북 상주로 귀농해 사과 농사를 짓는 김현웅 씨는 “따뜻한 날씨로 사과꽃의 개화 시기가 5월 초순에서 4월 중순으로 당겨지면서 냉해 피해가 심각하다”며 “사과꽃이 핀 뒤 꽃샘추위가 찾아오면 꽃이 죽고, 열매가 맺히지 않는다”고 말했다. 귀농 초기 심었던 감나무는 몇 해전 전부 베어버렸다. 포근한 겨울 날씨에 곰팡이가 펴 곶감 건조에 실패했기 때문이다. 상주 명물 곶감도 옛말이 돼가고 있다. 호냉성 작물인 인삼은 그간 남부 지역인 충남 금산, 경북 풍기 등에서 주로 생산돼 왔지만, 최근에는 경기 포천, 강원도 홍천·횡성 일대로 재배지가 옮겨가고 있다. 약재로 많이 쓰이는 천궁, 당귀의 재배지도 북쪽으로 올라가는 추세다. 대신 따뜻한 곳에서 잘 자라는 감귤은 제주를 벗어나 전북, 전남, 경남 등 남부 내륙지역으로 재배지역을 확장해가고 있다. 재배지 북진, 온대 과일·작물 소멸의 징후 관측 주요 과일·작물의 재배지역이 북진하는 현상은 머지않은 미래 한반도에 온대 작물이 자랄 수 없는 시기가 도래할 수 것이라는 위기감을 고조시킨다. 농촌진흥청은 오는 3분기 중으로 SSP5 기후 변화 시나리오(현재 수준으로 온실가스 배출)를 반영한 주요 작물의 재배지 변동 예측 결과를 담은 ‘미래 작물 재배지도’를 발표할 예정이다. 2년 전 6대 과일(사과·배·복숭아·포도·단감·감귤)의 재배지 변동을 예측했던 ‘미래 과일 재배지도’의 후속판으로, 이번엔 차나무, 올리브 등 아열대 과수를 다루는 것으로 전해졌다. 더워지고 있는 한반도가 아열대 작물들의 재배적지가 될 것이란 내용이 담길 것으로 보인다. 이미 망고, 바나나, 한라봉, 파파야, 용과 등이 남부 지역에서 재배되고 있다. 김성겸 경북대 원예과학과 교수는 “기온 상승으로 우리나라 국토에서 사과, 고랭지배추 등 호냉성 과일·작물들의 재배가 점점 힘들어진다”면서 “이는 생산량 감소로 이어져 가격이 오르고, 마늘 등 일부 작물의 생태계에 심각한 영향을 주고 있다”고 우려했다. 한현희 온난화대응농업연구소 연구관은 “온실가스 배출을 줄여 기후변화에 대응하지 않으면 머지않은 미래에 주요 과일, 작물의 씨가 마를 수 있다”며 “탄소 중립 노력과 함께 기후변화에 적응할 수 있는 품종을 개량하고 새로운 재배법을 개발하는 노력도 병행해야 할 것”이라고 강조했다. 사진 제공= 참두레농장",https://n.news.naver.com/mnews/article/018/0005675697?sid=101
북극 한파 원인은 ‘역대급’ 따뜻한 지구,"[앵커] 지난해 12월, 동장군이 한반도에 닥쳤을 때 인천 앞바다가 꽁꽁 얼어붙은 모습입니다. 한강 주변 곳곳에는 고드름이 얼었죠. 적지 않은 수도 계량기도 동파됐습니다. '숨만 쉬어도 코털이 얼어붙는다'는 동장군의 위세... 이달에도 계속되고 있습니다. 동장군이란 말, 어휘 자체에서 추위가 느껴지죠. 이 단어는 1812년, 러시아를 침공한 나폴레옹의 60만 대군이 한파로 쓰러져 일부만 살아서 돌아갔는데... 이를 두고 영국 언론이 general frost라 칭했고, 일본에서 동장군이라 번역해 우리나라에서도 같은 표현을 쓰면서 동장군이란 표현이 생겼다는 설이 유력하죠. 우리가 몸으로 느끼는 온도를 '체감온도'라고 하는데요. 바람까지 강해 오늘 서울의 체감온도는 영하 20도까지 뚝 떨어졌습니다. 이처럼 한반도를 덮친 동장군의 원인은... 북극한파... 북극 등 고위도 지역에서 내려오는 찬바람 때문입니다. 매년 더 자주 나타나고 있다고 하는데요. 그 이유, 이슬기 기자가 알아봤습니다. [리포트] 극지연구소에서 분석한 북극의 지난해 위성 사진입니다. 특히, 북극의 여름에 해당하는 9월에 찍은 사진을 보면 해빙이 줄어든 게 확연히 드러납니다. 1980년대부터 30년 간 평균 면적보다 약 13% 줄었습니다. [김현철/극지연구소 원격탐사빙권정보센터장 : ""(지난해 9월) 평균을 넘어가는 얼음의 변화량이 있었죠. 왜냐하면 작년 같은 경우 얼음이 상당히 많이 녹았던 해로…""] 실제로,  미국 해양관리국이 관측한 지난해 7월부터 9월 북극 지역의 평균 기온은 6.4도로, 관측이 시작된 1900년 이후 가장 높습니다. 이렇게 지구 온난화의 영향으로 따뜻해진 북극이 한반도 등 중위도 지방에 이례적인 추위를 몰고 온다고 학계는 분석하고 있습니다. '폴라보텍스'라고 부르는 북극의 찬 바람은 평소 북극 상공을 맴도는 제트 기류에 단단히 갇혀 있습니다. 하지만 햇빛을 반사하던 북극의 얼음이 녹으면, 수온이 오르면서 고기압이 형성되고, 제트기류가 교란돼 찬 바람이 내려오게 됩니다. [국종성/포스텍 환경공학부 교수 : ""(얼음이 없으니까) 바다로부터 열이 계속 전달이 되는 거죠. 열이 전달되면 대기가 따뜻해지면서 거기에 고기압성 흐름이 만들어지거든요. 온도풍이라고 하는데 고기압성 순환이 생겨요.""] 학계에서는 지구 온난화가 지금 같은 추세로 진행된다면, 오는 2030년 대에는 여름철 북극 해빙이 없어질 수도 있다고 우려합니다. KBS 뉴스 이슬기입니다. 촬영기자:최연송/영상편집:유지영/그래픽:채상우 고석훈 ■ 제보하기 ▷ 전화 : 02-781-1234, 4444 ▷ 이메일 : kbs1234@kbs.co.kr ▷ 카카오톡 : 'KBS제보' 검색, 채널 추가 ▷ 네이버, 유튜브에서 KBS뉴스를 구독해주세요!",https://n.news.naver.com/mnews/article/056/0011647020?sid=102
[친절한 뉴스K] 따뜻해진 지구…북반구는 ‘덜덜’,"[앵커] 전국의 기온이 뚝 떨어진 가운데 매서운 추위가 이어지고 있습니다. 이번 강추위는 이른바 '북극 한파' 때문인데요. 고위도에서 중위도로 찬 바람이 내려온 이유가 무엇인지 친절한 뉴스에서 전해드립니다. 김세희 기자입니다. [리포트] 두꺼운 외투에 목도리와 장갑까지, 오늘 강추위에 단단히 대비한 분들 많으셨죠. 서울 출근길 체감 온도가 영하 20도 아래로 내려가는 등 올 겨울 들어 가장 추운 아침이었습니다. 이번 한파의 원인은 북극에서 내려온 찬 바람인데요. 이른바 '북극 한파'는 미국을 먼저 강타했습니다. 지난주 미국에서는 일주일 동안 90명 이상이 숨졌고, 일부 주에는 비상 사태가 선포됐습니다. 유럽엔 북극 한파로 인한 겨울 폭풍까지 불어닥쳤습니다. 겨울 폭풍 '이샤'가 유럽을 덮치면서 항공기 2백여 편이 결항되거나 취소됐습니다. 영국에선 열차 운행도 중단됐고, 아일랜드에선 주택과 사무실 17만 곳의 전기가 끊겼습니다. 미국에서도 피해가 계속 늘고 있습니다. 인디애나주에는 1m 넘는 폭설이 쌓여 대설 비상 사태가 선포됐습니다. [데이브 웨스트팔/제설업체 직원 :  ""(날씨가) 미쳤다고 표현해도 될까요? 사흘 동안 잠도 못 자고 나와 있어요.""] 테네시주 멤피스에선 40만 명에게 수돗물을 공급하는 수도관이 파열됐고, 오리건주에서는 한파 속에 4만 5천 명이 정전 피해를 겪었습니다. 미국 CBS 방송은 날씨로 인한 각종 사고나 저체온증 등으로 숨진 사람이 한 주 동안 90명을 넘어섰다고 집계했습니다. 이렇게 고위도에서 찬 바람이 내려오는 원인은 뭘까요. 전문가들은 지구 온난화의 영향이라고  분석했습니다. 극지연구소에서 분석한 북극의 지난해 위성 사진입니다. 특히, 북극의 여름에 해당하는 9월에 찍은 사진을 보면 해빙이 줄어든 게 확연히 드러납니다. 1980년대부터 30년간 평균 면적보다 13%가량 줄었습니다. [김현철/극지연구소 원격탐사빙권정보센터장 :  ""(지난해 9월) 평균을 넘어가는 얼음의 변화량이 있었죠. 왜냐하면 작년 같은 경우 얼음이 상당히 많이 녹았던 해로…""] 실제 미국 해양관리국이 관측한 지난해 7월부터 9월 북극 지역의 평균 기온은 6.4도로 관측이 시작된 1900년 이후 가장 높았습니다. 전문가들은 따뜻해진 북극이 한반도 등 중위도 지방에 이례적인 추위를 몰고 온다고 분석하고 있습니다. '폴라보텍스'라고 부르는 북극의 찬 바람은 평소 북극 상공을 맴도는 제트 기류에 단단히 갇혀 있습니다. 하지만 햇빛을 반사하던 북극의 얼음이 녹으면 수온이 오르면서 고기압이 형성되고 제트기류가 교란돼 찬 바람이 내려오게 됩니다. [국종성/포스텍 환경공학부 교수 :  ""(얼음이 없으니까) 바다로부터 열이 계속 전달이 되는 거죠. 열이 전달되면 대기가 따뜻해지면서 거기에 고기압성 흐름이 만들어지거든요. 온도풍이라고 하는데 고기압성 순환이 생겨요.""] 학계에서는 지구 온난화가 지금 같은 추세로 진행된다면 2030년대에는 여름철 북극 해빙이 없어질 수도 있다고 우려합니다. 지금보다 더 강한 추위는 언제든지 우리를 찾아올 수 있습니다. KBS 뉴스 김세희입니다. 영상편집:신선미/그래픽:민세홍 ■ 제보하기 ▷ 전화 : 02-781-1234, 4444 ▷ 이메일 : kbs1234@kbs.co.kr ▷ 카카오톡 : 'KBS제보' 검색, 채널 추가 ▷ 네이버, 유튜브에서 KBS뉴스를 구독해주세요!",https://n.news.naver.com/mnews/article/056/0011647725?sid=102
