title,content,link
온난화로 사라져가는 빙하의 눈물을 마시다,"[지구 온난화 현장을 가다] 땅에서 본 로키 (1) 2006년 아데바스카 빙하가 이곳까지 있었다는 표지판 로키산을 보기 위해 방문했던 지난 8월, 캐나다에서는 1,000여 곳에서 통제 불능 상태로 산불이 번지고 있었다. 피해 면적 14만㎢, 남한 면적의 1.4배. '지구온난화'로 인해 캐나다의 숲이 매우 건조하고 메말라서 그 '숲'이 불쏘시개가 돼 순식간에 번졌던 것. 지구상의 탄소를 저장하고 흡수해야 할 캐나다 숲이 산불로 인해 탄소를 배출하고, 그 연기(스모그)는 인류의 건강에 큰 재앙으로 다가온다. 당시 캐나다 산불 연기는 대서양을 넘어 온 지구로 퍼지는 중이었다. 메마르고 건조한 숲이 불에 타고, 그 산불은 탄소를 배출하고 '지구온난화' 를 가속시키는 '악순환'이다. 엎친 데 덮친 캐나다 산불 컬럼비아빙원의 하늘도 흐릿했다. 캐나다 산불 연기와 구름이 뒤섞여 있는 것이다. 2006년에 빙하가 있었던 위치가 연기 자욱한 현재의 빙하와 대비된다. 컬럼비아빙원 부근의 6개의 빙하 중에 아데바스카Athabasca 빙하가 있다. 현재 폭 1㎞ 정도, 길이 6㎞ 정도인데, 상당히 뒤로 후퇴해 있다. 1971년에 촬영된 이 빙하는 현재 도로 앞부분까지 내려와 있는 것이 보인다. 그 후인 2011년의 빙하 사진과, 2021년 빙하 사진을 보면 빙하가 계속 줄어들고 있는 것이 확연하다. 아데바스카빙하의 왼쪽에 보이는 빙하와 오른쪽에 보이는 빙하는 금방이라도 녹아서 사라질 듯 위태롭기만 하다. 설상차가 있는 주차장으로 오르는길. 컬럼비아 아이스필드 센터와 셔틀버스. 중앙에 있는 아데바스카빙하 탐방에 나선다. 지구온난화의 현장을 더욱 가깝게 보기 위해서이다. 그곳의 빙하에 들어가기 위해서는 컬럼비아 아이필드 센터에서 셔틀버스를 타야 한다. 셔틀버스 주차장을 떠난 버스는 산길을 올라 설상차 주차장까지 간다. 그곳에서 빙하 지역에 들어갈 수 있게 특수 제작된 바퀴가 사람 키만큼 큰 설상차로 바꿔 탄다. 설상차는 비포장의 오르막길을 올라가 빙하 지역으로 진입하게 되는 것이다. 빨간색의 설상차 주차장. 빙하 지역 진입하는 오르막길. 10여 년 전보다 훨씬 줄어든 빙하 빙하 지역 진입하기 전에 높은 언덕에 서니 아데바스카빙하의 끝부분과 빙하호수가 보인다. 빙하는 계속 녹아 흘러서 빙하호수 쪽으로 흘러 들어간다. 지구온난화로 빙하가 계속 녹아서 조금 있으면 빙하호수는 더욱 커질 것이다. 멀리서 빙하 트레킹 하는 사람들이 개미처럼 보인다. 설상차와 탐방객들. 언덕을 내려와 빙하로 진입하니, 하천처럼 물이 고인 곳을 지나는데 일반 차량이 들어오지 못하는 까닭을 알 것 같다. 설상차의 바퀴 자국이 녹은 빙하 위에 선명히 드러나고 금방이라도 금이 간 빙하가 마치 빵조각처럼 떼어질 것 같은 모습이다. 큰 바퀴의 설상차는 천천히 전진하며 아데바스카빙하 중턱에 도착했다. 빙하에는 여러 대의 설상차와 탐방객들이 있었다. 주변에는 더 이상 빙하 안으로 들어가지 말라는 표시가 있었다. 그 표시구역 밖에는 위험구역이리라, 빙하는 자구온난화로 하염없이 녹아 흐르고 있다. 그 빙하수는 개울을 만들어 빙하호수로 흘러 들어가고 있다. 상온 영상 15℃ 정도… 이 높은 온도에 빙하가 녹지 않는다면 더 이상할 것이다. 오히려 빙하가 이렇게라도 버텨주고 있음에 감사할 뿐이다. 녹아 흐르고 있는 빙하수를 만져보는 탐방객. 녹아 흐르고 있는 빙하수를 마시는 탐방객. 힘들게 버텨내고 있는 빙하 저 멀리 녹아 흐르는 빙하 위에는 또 다른 계단식 빙하Icefall가 지켜보고 있다. 저 너머에는 넓은 빙원이 있으리라. 흐르는 빙하수를 물병에 담아 마셔본다. 그린란드의 이누이트마을에서 빙하 얼음을 녹여서 커피를 타 마신 경험이 있으나, 이렇게 녹아 흐르는 빙하수를 마셔보는 것은 처음이다. 어떤 맛일까… 그리 시원하지 않은 빙하수로서 하늘에서 방금 내린 빗물의 맛이다. 조금 미지근하고, 그리 개운치 않은 맛… 왜 그럴까… 마치 체한 것 같은 그런 느낌이다. 기후변화가 기후 재앙이 되고 있고, 지구온난화가 기후 열대화가 되어가는 시점에서 캐나다 산불의 뿌연 연기와 속절없이 녹아내리는 빙하를 바라보면서 나는 과연 무엇을 해야 할까. 개울을 만들어 녹아 흐르는 빙하수. 뿌연 캐나다 산불 연기와 녹아내리는 아데바스카 빙하. 월간산 12월호 기사입니다.",https://n.news.naver.com/mnews/article/094/0000011428?sid=103
"""강원도 사과? 10년 전엔 코웃음""... 지구온난화로 북상한 '금사과'를 따다","부사 수확에 한창인 기자와 일행들. ""와 빨간 게 진짜 탐스럽네. 강원도에도 이렇게 사과가 잘 열려요?"" 지난 10월 29일 강원도 평창에 있는 한 과수원 앞을 지나던 자동차가 2차선 도로에 차를 세웠다. 주말을 맞아 평창 송어마을에 점심을 먹으러 간다는 50대 부부는 빨갛게 익은 사과에 눈길을 빼앗긴 채 연신 스마트폰으로 사진을 찍어댔다. 나무에 달린 사과를 가까이서 본 건 처음이라는 이 부부는 ""얼마나 키워야 열매가 맺히느냐"" ""강원도에서 언제부터 사과 농사를 지었냐"" 등 여러 질문을 쏟아냈다. 사과 중 제일 맛있다는 부사 수확철이 다가오면서 전국 사과 농가들의 일손이 바빠지고 있다. 따는 시기가 맛에 영향을 미치는 만큼, 사과 농장이 있는 마을 사람들도 이때만큼은 함께 팔을 걷어붙인다. 사과는 현재 국내 재배 과일 중 생산액 비중이 1위다. 그러나 농촌진흥청의 기후변화 시나리오에 따르면, 70년 후 사과는 전국적인 과일의 지위를 잃을 전망이다. 지구온난화 탓에 강원도 이남에서는 재배가 어려워질 가능성이 높다는 것이다. 지난 10월 29일 강원도 평창군 용평면에 위치한 한 과수원. 사과의 대장 부사 수확철 실제 '사과' 하면 대구·경북과 충남을 떠올리는 것도 이미 옛말이 되었다. 기후변화 탓에 사과 산지는 자꾸 북상 중이다. 사과는 연평균 기온이 8도에서 11도의 서늘한 기후에서 재배되는 과일이다. 일교차가 커야 열매가 잘 익는다. 그러나 지구온난화로 기존의 주요 산지였던 경북이나 충남 지역에서는 사과 재배가 어려워지고 있다. 농촌진흥청에 따르면, 대구·경북지역 사과 재배 면적은 1993년 3만6021㏊에서 올해 2만151㏊로 30년 새 44% 줄었다. 반면 강원도는 같은 기간 483㏊에서 1679㏊로 3배 넘게 증가했다. 강원도에서는 사과 재배 조건이 갖춰지자 사과 농사에 뛰어드는 사람도 꾸준히 늘고 있다. 강원도 평창군에서 10년 넘게 사과를 재배하고 있다는 60대 김모씨는 ""10년 전만 해도 강원도에서 사과 농사를 짓는다고 하면 코웃음을 쳤다. 사과는 나무를 심어도 수확하기까지 몇 년은 걸리기 때문에 일찍 시작한 게 탁월한 선택이었다""고 설명했다. 일손 하나가 아쉬운 시기, 지인들과 사과 농가를 돕기 위해 강원도 사과 밭으로 향했다. 사과 수확은 이른 아침부터 시작한다. 나무 아래 일렬로 놓아진 노란색 사과 상자들을 해가 질 때까지 채워나가야 한다. 과수원 사장 김모씨는 ""제사상에 올리는 홍로는 9월 말에 수확하지만, 사과의 대장이라 불리는 부사는 10월 말부터 날씨를 봐서 수확하기에 요즘이 눈코 뜰 새 없이 바쁘다""고 했다. 사과 수확은 장갑과 모자를 착용하는 것부터 시작했다. 농촌 가을볕은 도시보다 뜨거워 태양 아래 5분만 서 있으니 한기는 사라지고 윗도리를 벗을 만큼 땀이 흥건해졌다. 과수원에는 수로를 가운데 두고 총 600그루의 사과나무가 있었는데 기자 일행은 왼쪽 밭의 4줄을 처리하는 임무를 맡았다. 한 줄당 약 40그루의 나무가 있는데 해가 잘 드는 한 쪽면 사과를 따는 것이었다. 수확한 사과와 함께 기념 사진을 찍고 있다. 상품성 있는 사과는 '꼭지'가 핵심 초보자라 수확 기술부터 배웠다. 사과 따기의 핵심은 '꼭지'라는 설명을 들었다. 꼭지와 연결된 가지 부분을 엄지손가락으로 '톡' 하고 누르면 된다. 포도처럼 가위로 따는 열매도 있지만, 사과는 손으로 딴다. 적과(결실양 조절을 위한 열매 솎기)를 할 때는 가위도 쓰지만, 열매를 딸 때는 손으로 해야 효율이 좋다. 잘 익은 사과는 금방 가지와 분리된다. 힘을 세게 주면 가지가 떨어져 나갈 수 있어 주의해야 한다. 정확한 부분을 눌러 나무와 분리시키는 것이 핵심이다. 꼭지가 떨어지면 상품 가치가 하락하기 때문에 주의해야 한다. 사과를 내려놓는 것도 중요하다. 사과는 멍이 잘들기 때문에 노란색 사과 박스 아래에 스치로폼부터 깔아줘야 한다. 이후 사과끼리 부딪치지 않도록 크기별로 잘 배치해야 한다. 이 때문에 외국인 노동자를 쓰는 것도 어렵다는 것이 과수원 사장의 말이다. 수확 과정을 외국어로 설명하기도 어려울뿐더러, 수확량만 채우려는 일꾼들은 멍든 사과만 자꾸 만들어내 과수원 주인들이 직접 하는 게 낫다는 것이다. 도시 청년 4명이 40그루의 한쪽 면 사과를 따는 데 걸린 시간은 30분 정도. 과수원 사장은 젊은 장정들이 와서 그런지 역시 속도가 다르다며 놀랐다. 두 줄을 한 시간 만에 해치우고 잠시 휴식에 들어갔다가 다시 오후 수확에 나섰다. 오후 2시를 넘기자 햇볕은 더 강렬해지고 사과를 따는 속도는 자꾸 느려졌다. 처음에는 단순노동이라 어려울 것이 없다고 생각했지만 허리를 굽혔다 세우는 동작이 이어지자 신체 부위들이 아파오기 시작했다. 처음에는 귀하게 느껴지던 빨간 사과들이 급기야 흔한 물건으로 보이기 시작했다. 하루치 작업량은 채우겠다는 일념으로 남은 두 줄을 겨우 끝낼 수 있었다. 약 2시간30분의 노동으로 할당량을 마쳤다. 이날 탐스러운 사과를 수확하는 젊은이들을 보고 인근에 놀러온 차들이 사과를 사기 위해 과수원으로 들어왔다. 대부분의 고객은 ""맛있는 사과 생산하느라 수고했다"" ""감사히 잘 먹겠다""고 인사를 건넸지만 일부 손님은 ""과수원에서 남아도는 게 사과인데 덤으로 더 달라""는 무례한 요구도 했다. 사과 수확철에는 낙과를 훔치려고 몰래 과수원을 침입하는 좀도둑들도 있다고 한다. 대부분 나이가 지긋한 사과 농장 주인들은 사람을 직접 상대하는 게 귀찮아 직거래보다 싼 값에 수확한 사과를 공판장에 넘긴다고 한다. 노동에서 오는 고단함은 견딜 수 있어도 사람을 상대하다 받는 스트레스는 마주하기 싫은 탓이다. 정부와 지자체가 농산물 물가 안정과 유통비 감소를 위한 다양한 경로를 모색한다고 하지만, 현장에서는 이윤이 덜 남더라도 직거래보다 기존 유통구조를 고수하는 이유가 이런 사정들 때문이다.",https://n.news.naver.com/mnews/article/053/0000039386?sid=102
31개국 에너지장관 “원전도 청정 에너지원 잠재력 있어”,"IEA 이사회서 처음으로 원전 역할 ‘인정’ ‘韓주도’ CFE 이니셔티브도 성명서 담아 [이데일리 김형욱 기자] 주요 31개국이 14일(현지시간) 프랑스 파리에서 열린 국제에너지기구(IEA) 각료 이사회에서 원자력발전(원전)도 청정 에너지원으로서의 잠재력이 있다고 발표했다. 국제사회에서 원전을 포함한 무탄소에너지(CFE) 활용을 탄소중립 수단으로 인정받으려는 한국 정부·업계의 노력이 주요 무대에서 인정받는 모습이다. 국제에너지기구(IEA)가 13일(현지시간) 프랑스 파리 경제협력개발기구(OECD) 본부 회의실에서 진행한 각료 이사회 모습. 최남호 산업통상자원부 제2차관을 비롯한 31개국 기후·에너지 장관급 인사는 이 자리에서 탄소중립을 위한 공동 성명을 발표했다. (사진=산업부) 15일 산업통상자원부 등에 따르면 31개국 기후·에너지 장관급 인사는 14일(현지시간) 이 같은 내용을 담은 공동 성명을 발표했다. IEA 차원의 성명에서 원전을 화석연료 의존도를 줄이기 위한 역할을 인정한 것은 이번이 처음이다. 이번 성명은 IEA가 지난해 말 아랍에미리트(UAE) 두바이에서 열린 유엔 기후변화협약 당사국 총회(COP28) 결과를 이행하기 위해 나아갈 길을 제시하는 내용을 담았다. 국제사회는 COP28에서 지구온난화 등 기후변화를 억제하기 위해 화석연료를 다른 친환경 에너지원으로 전환하고, 재생에너지 생산량을 3배 확대하자는 데 합의한 바 있다. 또 원전 활용 22개국은 원전 3배 확대하자고 선언하기도 했다. IEA 차원의 이번 성명에선 “지구 평균온도 상승을 산업화 이전의 1.5도 이내로 제한한다는 목표를 위해선 2035년까지 전력 부문을 대부분 탈탄소화해야 한다”고 말했다. 또 “안전과 보안, (핵무기) 비확산을 최고 수준으로 보장한다는 전제 아래 원전 역시 청정 에너지원으로서의 잠재력을 인정한다”고 발표했다. 한국 정부·산업계 주도로 글로벌 확산을 모색 중인 CFE 이니셔티브 관련 내용도 담겼다. 성명은 “재생에너지는 물론 저탄소 수소와 탄소 포집 후 활용·저장(CCUS) 기술을 포함한 최신 무탄소 기술의 보급 확대가 필요하다”고 전했다. 한편 이번 이사회에 참석한 최남호 산업부 제2차관은 이번 이사회 참가를 계기로 파티 비롤 IEA 사무총장과 만나 주요국 CFE 활용을 위한 공동 연구를 추진키로 합의했다. 최 차관은 “한국은 글로벌 에너지 안보 확립과 청정에너지 전환 가속을 위해 노력을 아끼지 않을 것”이라고 말했다. 최남호 산업통상자원부 2차관(왼쪽)이 13일(현지시간) 프랑스 파리 경제협력개발기구(OECD) 본부 회의실에서 파티 비롤 국제에너지기구(IEA) 사무총장과 악수하고 있다. 둘은 이 자리에서 무탄소에너지(CFE) 관련 공동연구 추진과 청정에너지 확대 협력 방안 등을 논의했다. (사진=산업부)",https://n.news.naver.com/mnews/article/018/0005674240?sid=101
“온난화로 2050년 해수면 3.6cm… 상승 인천은 4cm”,"극지硏, 지구 기온 2 3도 상승 가정 빙하 손실량 따른 해수면 변화 예측 뉴스1 지구온난화로 인해 2050년 지구의 해수면이 평균 3.6cm 상승한다는 국내 연구진 연구 결과가 나왔다. 특히 인천의 해수면은 전 세계 평균보다 높은 4cm 올라간다는 전망이다. 극지연구소는 극지방의 빙하가 녹아 2021년 대비 2050년 지구의 평균 해수면이 약 3.6cm 오른다는 연구 결과를 3일 발표했다. 특히 한국 인천의 해수면은 지구 평균보다 11% 높은 4cm 상승할 것으로 예측됐다. 극지연구소 이원상 박사 연구팀은 1992년부터 2021년까지 인공위성으로 관측한 남극과 그린란드 빙하량의 변화를 분석하고, 이에 기반해 2050년까지의 해수면 변화를 예측했다. 연구팀은 전 지구의 온도가 2∼3도가량 높아질 것이라는 가정하에 미래의 빙하 손실량을 계산했다. 연구팀은 중위도와 저위도 지역에서 해수면 상승이 두드러질 것으로 전망했다. 특히 인천의 해수면은 4cm 상승해 싱가포르(3.9cm), 뉴욕(2.9cm), 런던(1.7cm), 시드니(3.5cm) 등 연구진이 비교한 5개 주요 해안 도시 중 해수면 상승 폭이 가장 클 것으로 추산됐다. 평균 해수면이 상승할 경우 태풍과 같은 자연재해가 발생할 때 해일 등 파도의 높이가 높아지면서 연안의 피해가 커질 수 있다. 극지연구소에 따르면 남극과 그린란드에는 지구의 해수면을 65m 높일 만큼의 빙하가 쌓여있고, 빙하 손실량이 빠르게 증가하고 있다. 연구진은 이번 달 극지에서 가장 취약한 지역 중 하나로 꼽히는 남극 ‘스웨이츠 빙하’에서 정밀 관측을 수행할 계획이다. 김병훈 극지연구소 연수연구원은 “이번 연구 결과는 극지방의 빙하 손실만을 고려한 최소한의 수치”라며 “1.5도 이내의 온도 상승 감축 목표를 달성하지 못한다면 해수면이 더 심각하게 상승할 수 있다”고 말했다.",https://n.news.naver.com/mnews/article/020/0003540691?sid=102
"해수부·해양과학관, 해양과학 동화책 '뜨거워진 바다' 발간","전국 국공립 도서관에 기증…교육기관에 무료 배포 [서울=뉴시스] 해양과학 동화책 '뜨거워진 바다'. [서울=뉴시스] 박성환 기자 = 해양수산부(장관 강도형)와 국립해양과학관(관장 김외철)은 해양과학에 대한 흥미를 유발하고 어린이들에게 해양과학을 쉽고 재미있게 설명하기 위해 만든 해양과학 동화책 '뜨거워진 바다'를 발간했다고 12일 밝혔다. 이 동화책은 해양학, 교육학, 동화제작 분야의 전문가 8명이 참여해 제작했다. 동화책에서는 '눈퉁이'라는 가상의 해양생물을 주인공으로 내세워지구온난화가 해양생태계에 미치는 영향과 바다생태계의 중요성을 재미있는 삽화와 함께 어린이들의 눈높이에서 쉽게 설명하고 있다. 해수부와 해양과학관은 전국의 모든 어린이들이 이 동화책을 쉽게 접할 수 있도록 지난 1월부터 전국 1200여개의 국공립 도서관에 순차적으로 배포하고 있다. 또 동화책과 연계해 어린이들을 대상으로 교육프로그램을 개발하고, 유치원, 초등학교 등 교육기관에 무료로 보급할 예정이다. 강도형 해수부 장관은 ""해양과학 동화책이 미래 주역인 어린이들에게 해양에 대한 관심과 호기심을 일깨우고 바다 생태계의 중요성을 깨닫게 하는 데 도움이 되길 바란다""고 말했다．",https://n.news.naver.com/mnews/article/003/0012368418?sid=101
[표지로 읽는 과학] 아마존 열대우림 붕괴 위기…2050년이 '마지노선',"네이처 제공 이번 주 국제학술지 ‘네이처’ 표지에는 브라질 마투그로수주에 있는 도시 알타플로레스타에 위치한 아마존 열대우림의 안개 자욱한 아침 사진이 실렸다. 아마존 열대우림은 지구 생물 다양성의 10%를 확인할 수 있는 곳이다. 지구 기후를 안정화하는 데 도움을 주는 핵심적인 탄소 저장고이기도 하다. 아마존 열대우림 생태계가 망가지면 지구 전체에 재앙이 될 수 있다는 것이다. 마리나 히로타 브라질 산타카타리나연방대 생태학과 교수 연구팀은 국제학술지 ‘네이처’에 기후변화로 인한 스트레스로 아마존 열대우림이 이르면 2050년 생태계 복원이 불가능한 티핑포인트를 지나게 될 것이라고 14일 발표했다. 연구팀은 기후 모델, 관측 데이터 등을 이용해 지구 온난화, 연간 강우량, 계절별 강우 강도, 건기 기간, 산림 벌채 등 아마존 생태계에 스트레스를 일으키는 5가지 요인을 분석했다. 그 결과 스트레스 요인들로 인해 아마존 열대우림의 10~47%가 2050년 생태계 붕괴가 일어나는 티핑포인트를 지나게 될 것이란 예측 결과가 나왔다. 앞선 연구에서는 아마존 열대우림의 20~25%가 벌목으로 훼손되면 티핑포인트가 올 것으로 전망됐었으나 이번 연구에서는 이미 열대우림의 25% 이상이 훼손된 것으로 파악했다. 6500만년 동안 아마존 열대우림은 기후 변동성에도 회복력을 유지해왔다. 하지만 지구 온난화, 극심한 가뭄, 산림 벌채, 화재 등 전례 없는 스트레스가 지속되면서 생태계 복원력에 한계가 오고 있는 상황이다. 연구팀은 “티핑포인트에 도달하면 대규모 붕괴가 일어날 수 있다”며 “아마존 열대우림이 회복력을 유지할 수 있도록 산림 황폐화를 막는 지역사회의 노력과 온실가스 배출을 막는 글로벌 노력의 조화가 필요하다”고 말했다.",https://n.news.naver.com/mnews/article/584/0000025989?sid=105
