title,content,link
"[장찬주의 바다와 기후변화] 바다 산성화, 지구 온난화보다 더 큰 재앙 부를수도","기온 상승·해수면 상승에 이어 지구 기후계에 던지는 큰 위험 지구 평균온도 1.5도 상승하면 전 세계 산호초 70∼90% 소멸 “이거다 저거다 말씀 마시고…인천 앞바다에 사이다가 떴어도.” 코미디언 고 서영춘씨가 1960년 ‘원자폭소 대잔치’라는 프로그램에서 유행시킨 코믹송의 한 구절로 그 시절 사이다의 인기를 반영한다. 사이다에 포함된 이산화탄소가 일으키는 톡 쏘는 맛과 시원함 때문에 당시는 물론 지금도 인기가 높아 속 시원한 이야기를 ‘사이다 발언’이라고 부르기도 한다. 이러한 이산화탄소는 이제는 지구온난화를 일으킬 뿐만 아니라 톡 쏘는 맛이 나는 사이다에 비유될 정도로 바닷물을 역사상 유례없이 빠르게 산성화시켜 식량 안보까지 위협하는 골칫거리가 되었다. 기온 상승과 해수면 상승에 이어 바다 산성화는 인간 활동에서 유래하는 이산화탄소 배출이 지구 기후계에 던지는 가장 큰 위험이다. 바다 산성화 바다 산성화는 바닷물의 산성도가 증가(산성도 지표인 pH는 감소)하는 현상을 일컫는 말이다. 주로 대기 이산화탄소의 바다 흡수로 일어나며 부영양화, 산성도가 큰 담수 또는 바닷물 유입 등에 의해서도 발생한다. 지구온난화가 일으키는 기후 변화의 쌍둥이 악마로 불릴 정도로 그 피해가 크다. 그렇지만 바닷속에서 일어나므로 우리가 직접 보거나 느낄 수 없고 수온 상승에 비해 그 변화가 느리게 일어난다는 점에서 그 심각성을 간과하기 쉽다. 이런 점에서 대비가 더 어려운 기후 재난이라고 할 수 있는 것이다. 또한 지구 표면적 70%를 덮고 있는 바다는 생물이 서식할 수 있는 지구 공간 부피의 90%를 차지한다는 점을 고려하면 산성화는 더 심각한 문제다. 생물다양성 감소, 기후변화와 함께 인류가 당면한 시급한 국제 환경 문제로 대두돼 유엔은 빈곤 종식, 지구 보호, 평화와 번영 보장을 위한 17개의 지속가능 발전 목표 중 바다 생태계 관련한 14번째 목표에 바다 산성화를 포함했다. 세계기상기구(WMO)도 7개 기후지표 중 하나로 바다 산성화를 선정했다. 정부간기후변화협의체(IPCC)에 따르면 인간 활동에서 기원하는 대기 이산화탄소 30%를 바다가 흡수한다. 이로 인해 산업혁명 이후 현재까지 약 250년 동안 표층 pH가 0.1 정도 낮아져 산성도는 약 26% 증가했다. 이런 산성화 속도는 탄산칼슘을 골격으로 하는 바다생물이 산성화로 대멸종했던 5500만년 전보다 10배나 빠르다. 이는 지구 역사상 유례 없이 빠른 바다 산성화가 현재 진행 중임을 나타낸다. 지금과 같은 추세로 대기 이산화탄소 농도가 계속 증가한다면 21세기 말에는 pH가 0.2∼0.4 정도 낮아질 것이라고 한다. 어패류·갑각류 등에 치명적 타격 대기 이산화탄소를 흡수해 지구온난화를 완화하는 역할을 하는 바다는 흡수한 이산화탄소로 바닷물 화학 평형이 변해 산성도가 증가하는 중병을 앓게 된다. 바다생물에도 심각한 피해를 일으킨다. 특히 탄산칼슘으로 껍데기나 골격을 만드는 어패류, 석회조류, 갑각류 등의 피해 정도는 심각하다. 산성화로 바닷물에 탄산염이 줄어 탄산칼슘 껍데기 형성이 힘들거나 이미 형성된 탄산칼슘도 녹기 때문이다. 전 세계 바다 면적의 0.1%만 차지하지만 바다 생태계의 4분의 1을 지탱하는 게 산호초다. 산호초도 수온 상승과 바다 산성화로 심각한 위기에 직면해 있다. 유엔 생물다양성과학기구에 따르면 현재 전 세계 산호초 33%가 멸종 위기다. 세계에서 가장 큰 산호초인 호주의 대산호초는 이미 절반이 사라졌다. 더 나아가 IPCC에 따르면 지구 평균 온도가 1.5도 상승하면 전 세계 바다 산호초의 70~90%가 사라질 것이라고 한다. 알래스카 연어도 바다 산성화 영향을 받아 개체수와 크기가 줄고 있다. 연어 먹이인 바다나비(익족류라고도 함)라는 생물이 산성화로 껍질을 잘 형성하지 못해 그 수가 감소하고 있기 때문이다. 바다나비는 단백질이 풍부해 바다 감자칩으로 불릴 정도로 바닷새에서 연어 등의 어류까지 많은 동물이 먹기 좋아하기 때문에 개체수가 줄면 해양생물뿐만 아니라 먹이사슬 전체에 영향을 준다. 인류는 필요한 동물단백질의 17%를 바다에서 얻고 있다. 이런 가운데 2050년이 되면 인류가 필요로 하는 단백질이 2배 증가해 인류가 섭취할 동물단백질이 부족하게 되는 ‘단백질 위기(Protein Crisis)’가 올 수 있다는 경고가 나온다. 최근 우리나라 바다에서 어획량이 급감하고 가격이 뛰어 금징어로 불리는 오징어도 바다 산성화의 영향을 받아 개체수나 크기가 줄 가능성이 크다. 미국 우즈홀연구소에 따르면 오징어는 다음과 같은 세 가지 바다 산성화 영향을 받는다. 첫째, 알이 부화하는 데 더 긴 시간이 걸려 포식자에게 잡아먹힐 가능성이 커진다. 둘째, 어린 오징어 크기가 줄어든다. 셋째, 오징어의 귀 역할을 하는 이석은 모양이 불규칙하게 되고 오징어 기관이 늦게 발달한다. 오징어와 같은 두족류는 바다 먹이사슬의 핵심이다. 바다 산성화는 두족류를 먹는 다른 생물도 영향을 받지만 세계 어획량이 300만t에 이를 정도로 중요한 두족류 관련 어업에도 심각한 영향을 줄 것이다. 오징어가 우리나라 바다에서 사라진 명태와 같은 운명이 될지도 모를 일이다. 지구온난화 가속시킬 수도 미국, 독일, 영국 공동 연구진은 바다 산성화로 생물학적 황화합물인 디메틸황(DMS)의 농도가 낮아진다는 사실을 발견했다. 미세조류가 만드는 디메틸황 배출로 바다는 대기에 가장 많이 황을 공급한다. 대기에서 황 농도가 높아지면 태양 빛을 차단해 표면에 도달하는 태양 에너지가 감소하므로 냉각 효과를 일으키는데 산성화로 바다에서 대기로 황 배출이 감소하면 지구 표면에 도달하는 태양 에너지의 양이 증가해 온난화가 가속화할 수 있다. 온도 상승과 달리 바다 산성화는 쉽게 보지도 느끼지도 못한다. 그러나 그 영향은 온도 상승 못지않으며 심지어 인류의 생존이 달린 수산자원에도 심각한 영향을 미친다. 이미 과거에 일어난 바다 산성화와 그 피해가 지구에 기록돼 있다. 또한 현재 일어나는 바다 산성화는 과거 어느 지질시대보다 빠르게 일어나고 있다. 미리 대비하지 않으면 바다 산성화가 지구온난화보다 더 큰 재앙이 될 수 있다. “과거를 기억하지 못하는 사람은 잘못을 반복하기 마련이다.”(조지 산타야나) 한국해양과학기술원 책임연구원",https://n.news.naver.com/mnews/article/005/0001657110?sid=110
"전국 곳곳 12월 역대 최고기온 가능성…""겨울기온 상승 뚜렷""","전국 대부분 지역 최고 20도 안팎…제주는 23도 시민들 ""겨울 같지 않아…기후위기인가 싶기도"" 전문가 ""지구 가열되며 겨울 기온 상승 뚜렷"" [서울=뉴시스] 정병혁 기자 = 낮 최고기온이 21도까지 오르는 포근한 날씨가 예보된 8일 서울 종로구 광화문네거리에서 얇은 옷차림을 한 시민들이 이동하고 있다. 2023.12.08. jhope@newsis.com [서울=뉴시스]박광온 기자 = 낮 최고기온이 20도 안팎을 오르내리는 고온 현상이 이어지면서 시민들이 롱패딩 대신 얇은 외투를 꺼내 입고 있다. 지구온난화로 앞으로 고온 현상이 더 자주 더 강하게 나타날 수 있다는 전망이 나온다. 8일 기상청에 따르면, 이날 낮 최고기온은 15~20도를 오르내리겠다. 특히 경기북부와 강원영서에서 10도 이상, 그 밖의 전국 대부분 지역은 15도 이상으로 크게 오를 것으로 전망된다. 특히 충남 보령군과 경기 동두천시는 일 최저기온(9.8도와 5.5도)이 12월 기준으로 역대 두 번째로 높았다. 이날 낮 최고기온 집계가 끝나면 일부 지역에선 12월 기온으로는 역대 최고치를 기록할 것으로 관측된다. 서울 기준  역대 12월 일 최고기온은 지난 1968년 12월9일 17.7도이고, 2위는 같은 해 12월8일 16.6도다. 3위는 1949년 12월1일 16.4도다. 이날 서울 낮 최고기온은 16도로 예상되는 가운데, 역대 일 최고기온 기록을 경신할 가능성도 있을 것으로 보인다. 내일(9일)도 전국 대부분 지역에서 평년보다 5~10도가량 높은 기온이 나타나 12월 최고 극값을 경신하는 지역이 있을 것으로 전망된다. 다음 주까지도 아침 최저기온은 13도, 낮 최고기온은 18도까지 오를 것으로 예상된다. 이에 따라 시민들은 도심 곳곳에서 두꺼운 패딩을 손에 들고 다니거나, 패딩 대신 얇은 겉옷을 걸친 모습을 보였다. 이날 오전 11시께 서울 종로구 종로5가역 인근에서 패딩을 손에 들고 이동 중이던 30대 박모씨는 ""오늘은 날씨가 봄 같아서 좋기도 하지만 오후엔 기온 20도 정도까지 오른다고 해서 겨울이 맞나 싶기도 하다""고 말했다. [서울=뉴시스] 정병혁 기자 = 낮 최고기온이 21도까지 오르는 포근한 날씨가 예보된 8일 서울 종로구 광화문네거리에서 얇은 옷차림을 한 시민들이 이동하고 있다. 2023.12.08. jhope@newsis.com 패딩 대신 봄·가을용 코트를 입은 서민주(28)씨도 ""12월에 20도 가까운 기온을 보이는 게 신기하다""며 ""점점 겨울이 겨울 같지 않고, 여름이 여름 같지 않아서 기후 위기인가 싶다""고 했다. 기상청은 최근 겨울철 고온 현상의 원인으로 따뜻한 서풍의 유입을 지목했다. 기상청 관계자는 ""차가운 성질의 대륙 고기압이 저위도로 내려오면서 따뜻한 성질의 이동성 고기압으로 변했다""라며 ""이후 우리나라 남쪽에 위치한 고기압이 시계 방향으로 회전하며 우리나라로 따뜻한 서풍이 유입된 것이다""라고 말했다. 최근 해수면 온도 상승과 지구온난화 추세도 최근 겨울철 고온 현상에 영향을 미쳤다. 앞서 기상청은 지난달 23일 올겨울 3개월(12월~2월) 전망 자료를 통해 ""북풍류 유입이 감소하고 남쪽에서 수증기가 유입돼 평년보다 기온이 높은 경향을 보일 것""이라고 밝혔다. 1973년 기상 관측 이래 전체 기간 변화를 살펴보면 12월엔 큰 변화 경향은 없었으나 1월은 1.4도, 2월은 2.1도 각각 기온이 상승한 것으로 나타났다. 이런 예측 근거를 기준으로 이번 달 기온이 평년과 비슷하거나 따뜻할 확률이 각각 40%에 달했다는 분석을 내놓기도 했다. 1월은 평년과 비슷할 확률이 50%였고, 2월에도 평년과 비슷하거나 따뜻할 확률이 각각 40%로 전망됐다. 전문가들은 지구 온난화 추세 속에서 이 같은 겨울철 고온 현상이 앞으로 더 자주, 더 강하게 나타날 것으로 전망했다. 조천호 전 국립기상과학원장은 ""점점 지구가 가열되면서 겨울철 기온 상승은 더 빠르고, 더 뚜렷하게 나타나고 있다""라며 ""이번 고온 현상을 단순히 기후 위기 때문이라고 단정 지을 수는 없지만, 이 같은 상황이 점점 더 자주 그리고 더 강하게 나타날 가능성도 있다""고 밝혔다．",https://n.news.naver.com/mnews/article/003/0012256368?sid=102
온난화 못 막으면 이렇게 된다…지구 온도 ‘3도’ 오른 세계 도시들 보니,"물에 잠긴 남미·인도·아시아 도시들…지붕만 빼꼼 “지구 온도 3도 상승시 세계 8억명 거주지 수몰” 해안가와 저지대 도시, 소규모 섬나라들 생존 위협 커져 미국 뉴욕 자유의 여신상.현재(왼쪽) 모습과 지구 온도가 산업화 대비 3도(오른쪽) 올랐을 때 모습. 출처 Climate Central 미국 뉴욕의 상징인 자유의 여신상이 범람한 강위에 위태롭게 서있다. 세계에서 가장 높은 빌딩인 두바이의 부르즈칼리파는 사막이 아닌 물 위에 솟아있다. 제28차 유엔기후변화협약 당사국총회(COP28)가 지난 30일(현지시간)부터 아랍에미리트(UAE) 두바이에서 열리고 있는 가운데, 비영리 기후단체 클라이밋 센트럴(Climate Central)이 지구 온난화의 섬뜩한 미래를 보여주는 전 세계 196개 도시들의 이미지를 공개했다. 이 이미지는 온난화로 인한 해수면 상승 예측 결과와 지역별 고도 등을 종합해 시각화한 것으로, 지구 온도 상승폭에 따라 달라지는 도시의 모습을 구현했다. 그 결과 탄소 배출량을 급격히 줄여 지구 온도 상승폭을 산업화 이전 대비 1.5도 이내로 제한했을 때의 도시 모습은 지금과 큰 차이가 없었지만, 3도까지 올랐을 때에는 도로와 길이 물에 잠기고 심지어 도시 전체가 수몰되는 곳도 있는 것으로 나타났다. 재난 영화에서 보던 물에 잠긴 도시가 현실이 될 수 있다는 것이다. 지구 온도가 3도 올랐을 때 미국 워싱턴DC의 내셔널몰 앞 공원은 거대한 호수로 변했다. 쿠바 아바나의 명소 카테드랄 광장은 아예 물에 잠겨 형체를 알아보기 힘들다. 인도 뭄바이의 경우 우뚝 선 나무 전체가 물에 잠길 정도로 해수면이 높이 올라와 있다. 미국 워싱턴DC 내셔널 몰.현재(왼쪽) 모습과 지구 온도가 산업화 대비 3도(오른쪽) 올랐을 때 모습. 출처 Climate Central 쿠바 아바나 카테드랄 광장.지구 온도가 산업화 대비 1.5도(왼쪽), 3도(오른쪽) 올랐을 때 모습. 출처 Climate Central 인도 뭄바이의 샌그라할라야 박물관.지구 온도가 산업화 대비 1.5도(왼쪽), 3도(오른쪽) 올랐을 때 모습. 출처 Climate Central 일본 후쿠오카는 도시 전체가 물에 잠겨 지붕만 빼꼼히 물 밖으로 나와있고, 중국 광저우의 높은 빌딩들도 물속으로 사라졌다. 영국 런던과 글래스고의 차도와 인도가 모두 물길이 됐고, 관광명소인 버킹엄 궁전을 비롯해 세계 곳곳의 유적지와 유산들이 물에 잠길 것으로 예상된다. 일본 후쿠오카.현재모습(왼쪽)과 지구 온도가 산업화 대비 3도(오른쪽) 올랐을 때 모습. 출처 Climate Central 중국 광저우.지구 온도가 산업화 대비 1.5도(왼쪽), 3도(오른쪽) 올랐을 때 모습. 출처 Climate Central 영국 런던 버킹엄 궁전.현재모습과 지구 온도가 산업화 대비 3도(오른쪽) 올랐을 때 모습. 출처 Climate Central 현재 COP28이 열리는 무더운 사막 도시 두바이 역시 도시 대부분에 물이 들어차 더 이상 사막이 아닌 모습을 볼 수 있다. 아랍에미리트 두바이의 부르즈칼리파 빌딩.지구 온도가 산업화 대비 1.5도(왼쪽), 3도(오른쪽) 올랐을 때 모습. 출처 Climate Central 클라이밋 센트럴의 수석 과학자이자 최고경영자(CEO) 벤저민 스트라우스는 CNN과의 인터뷰에서 “이들 장소와 문화 유산의 생존 여부는 정부와 업계 지도자들이 지구 온난화를 1.5도로 제한할 만큼 충분하고 신속하게 탄소 오염을 줄이는 방안에 동의할 지 여부에 달려 있다”고 강조했다. 기후 과학자들은 현재 지구 온도가 산업화 이전 수준보다 1.2도 오른 수준으로, 앞으로 몇 년 안에 파리기후협약에서 제한하기로 약속한 1.5도 상승을 돌파할 것으로 예상하고 있다. 2015년 파리에서 열린 COP21에서 195개 국가들은 지구 온도 상승폭을 2도 이하, 바람직하게는 1.5도로 제한하는 ‘파리기후변화협정’에 서명했다. 과학자들은 이 온도를 넘어서면 인간과 생태계가 적응하기 어려울 것이라고 경고한다. 유엔은 최근 보고서를 통해 지금과 같은 추세라면 지구 온도가 최대 2.9도까지 상승할 것이라고 진단한 바 있다. 지구 온난화가 지속될 경우 빙하가 녹아 해수면이 상승하며 해안가나 저지대 도시, 소규모 섬나라는 생존의 위협을 받을 수 있다. 클라이밋 센트럴에 따르면 현재 약 3억8500만명의 사람들이 범람 위험지역에 살고 있으며, 지구 온도 3도 상승시 해수면의 변화로 세계 인구의 약 10%(8억명)의 거주지가 수몰될 것으로 예상된다. 특히 중국, 인도, 베트남, 인도네시아 등 아시아 국가는 해수면 상승으로 인한 위험이 가장 큰 국가들로 꼽혔다. 방글라데시 다카의 랄바그 요새.지구 온도가 산업화 대비 1.5도(왼쪽), 3도(오른쪽) 올랐을 때 모습. 출처 Climate Central 기상이변으로 인한 위협은 전세계 의료·보건 환경에까지 미치고 있다. 기후위험 분석기관인 상호의존성이니셔티브(XDI)가 2일 발표한 보고서에 따르면 홍수와 폭풍우, 산불 등 기상이변이 초래한 각종 재해로 인해 이번 세기말까지 전 세계 1만6245개 병원이 전체 또는 부분적으로 폐쇄될 것으로 나타났다. 위험에 처한 병원의 71%(1만1512곳)는 저소득 및 개발도상국에 위치해 있었다. 연구팀은 병원 폐쇄 위험이 가장 큰 지역은 동남아시아로, 기후위기가 현재 상태로 지속된다면 2100년까지 동남아 지역의 병원 5곳 중 1곳이 문을 닫게 될 것이라고 경고했다.",https://n.news.naver.com/mnews/article/032/0003265265?sid=104
"매화, 32일이나 빨리 피었다…""한국 온난화 속도 1.6배 빠르다""","15일 오전 제주 서귀포시 대정읍 구억리 노리매공원에 매화가 피기 시작한 모습. 연합뉴스 ‘봄의 전령’ 매화가 15일 제주에서 개화했다고 제주지방기상청이 밝혔다. 이는 평년보다 32일 빠른 기록이다. 정수종 서울대 환경대학원 교수는 “제주에서 매화 개화 조건이 충족했다는 얘기”라며 “서울도 조기 개화 가능성이 높다”고 전망했다. 기상청은 매화 관측목의 한 가지에 세 송이 이상 꽃이 활짝 피었을 때를 개화한 날로 기록한다. 기상청의 공식 개화 발표 이전부터 소셜미디어에서는 봄꽃 목격담이 있었다. 지난달부터 부산 등 남부 지역에 봄꽃이 피었다는 게시글이 이어졌다. 이준이 부산대 기후과학연구소 교수는 “저도 (부산에서) 볕이 잘 드는 곳에 봄꽃이 핀 모습을 봤다”며 “지구온난화에 엘니뇨 효과까지 더해지면서 지난해 가을철 평균 기온이 굉장히 높았고, 겨울철 기온도 평균적으로 높아 꽃들도 (개화 시기를) 헷갈리는 모양새”라고 했다. ━ 20도 넘은 제주 12월 날씨 제주지방기상청에 따르면 매화 관측목은 올해 1월 4일 발아하고 15일 개화했다. 지난해 12월과 올 1월 평균 기온이 모두 평년보다 오른 것이 주된 이유라는 게 기상청의 설명이다. 지난해 12월 제주 지역 평균 기온은 9.4도로 평년 기온(8.3도)보다 1.1도 높았다. 1월도 14일 기준 평균 기온이 8.3도를 기록했는데, 이는 평년보다 1.8도나 높다. 지난 달 13일 국회에 봄에 개화하는 노란 개나리가 피어있다. 연합뉴스 지난달 제주는 낮 최고 기온이 10도를 넘긴 날이 31일 중 21일이었다. 20도를 넘긴 날도 5일이나 됐다. 1월 들어서는 매화가 피기 전날까지 14일 중 10일 동안 낮 최고기온이 10도를 웃돌았다. 14일에는 18.4도까지 오르면서 평년 기온보다 10도나 높았다. 발아 전인 12월에는 기온 변동폭이 컸다. 낮 최고 기온이 20.8도(12월 15일)에서 이틀 만에 3.9도(12월 17일)로, 17도 가까이 급전직하한 날도 있었다. 15일 제주지방기상청의 매화 관측목에 매화 꽃이 활짝 핀 모습. 사진 제주지방기상청 정수종 교수는 “매화는 단순히 날씨가 따뜻하다고 해서 발아·개화하지 않는다. 매화 꽃이 피기 위해서는 저온요구도(일정 수준의 낮은 기온)와 고온요구도(일정 수준의 높은 기온)를 모두 충족시켜야 하는데, 이런 조건을 모두 충족했다”며 “매화 조기 개화는 전반적으로 기온이 따뜻하면서 변동폭도 높은 온난화의 특징을 상징적으로 보여주는 사례”라고 설명했다. ━ “韓 온난화 속도 1.6배 빠르다” 기상청은 16일 발표한 2023년 연 기후 특성 보고서에서 “지난해 우리나라 연평균기온은 13.7도로 역대 1위 기록했다”고 발표했다. 지난해 지구 평균기온도 14.98도로 기록하며 산업화 이전보다 1.45도 오른 것으로 집계됐다. 이는 전 지구가 산업화 혁명 이후 가장 뜨거웠으며 2015년 파리기후변화협약에서 제시한 인류 목표인 ‘1.5도’ 선에 육박했음을 의미한다. 8월 낮 한반도 주변 기온과 불쾌지수가 붉게 표시된 모습. 사진 세계 기상 정보 비주얼맵 어스널스쿨 삼면이 바다로 둘러싸인 우리나라는 평균 기온 상승과 함께 대기 속 수증기가 풍성해지며 강수량도 큰 폭으로 늘었다. 지난해 연간 총 강수량은 1746㎜로 평년 강수량의 131.8% 수준이었다. 5~7월에 강수가 집중돼 비가 오지 않는 달과 비가 오는 달의 강수량 편차가 커 가뭄과 홍수가 나타났다. 12월에는 한 달 총 강수량이 평년의 4배 가까이 늘면서 역대 12월 강수량 1위를 기록했다. 유희동 기상청장은 “장마철 기록적인 집중호우와 관측 이래 처음으로 남북을 관통한 태풍 등 경험해보지 못한 위험기상으로 피해를 봤다”고 말했다. 지구온난화 현상이 본격적으로 나타나면서 지난해 초에도 봄꽃이 일찍 개화하고 졌다. 반기성 케이웨더 센터장은 “우리나라는 지구 전체보다 온난화 속도가 1.6배 정도 빠르다”며 “앞으로도 봄꽃 개화 시기가 당겨지고 너무 이르게 핀 꽃이 서리를 맞고 떨어지면 매실 등의 작황에 전반적인 영향을 줄 수 있다”고 내다봤다.",https://n.news.naver.com/mnews/article/025/0003335414?sid=102
"COP28, 지구 온난화 주범 '석유·석탄' 의존 벗어나기 명문화  합의…'단계적 퇴출' 명시엔 이견","[앵커] 198개 나라를 회원국으로  두고 있는 '유엔  기후 변화협약  당사국 총회'에서 의미있는 합의가 도출됐습니다.  지구 온난화의  주범으로 지목된  화석연료의  사용을  '줄이자'는  건데요, 아쉽게도 화석연료의 '단계적 퇴출'은 산유국 등의  이견으로   명문화 하진 못해 합의 내용이  충분치 않다는   지적도 나옵니다. 김자민 기자입니다. [리포트] 2주간 열린 유엔 기후변화협약  당사국 총회,   합의안이  극적으로 타결되자  박수가 터져나옵니다. 총회가 시작된지  28년 만에, 석유와 석탄 등 화석연료로부터  벗어나기 위한 지구촌 공동의  첫 합의가 이뤄진 겁니다. 술탄 알자베르 / 총회 의장 ""우리는 지난 2주간 지구의 더 나은 미래를 확보하기 위해 매우 열심히 일했습니다."" 합의문의 핵심은 초안의  '화석연료 생산과  소비를 줄일 수 있다'는  애매한 표현에서  지구 온난화의 주범인 화석연료에서  '멀어지는 전환'을 명시한 겁니다. 앞서 100여개 회원국은   '단계적 퇴출' 표현을  넣자고 요구했지만 산유국들이 반대했고, 난상토론 끝에  '멀어지는 전환'이란  절충안이 채택됐습니다. 장 수 /생물다양성센터 공동 책임자 ""거의 30년 동안 전세계가 화석 연료 문제에 대처하길 거부해온 끝에 마침내 대응하고 있다는 좋은 신호입니다."" 다만  재생에너지 생산 확충에 대한  명확한 목표나  석탄화력발전에 대해  더 강력한  퇴출 의지를   담지 못했다는 점은 아쉽다는 지적입니다. TV조선 김자민입니다.",https://n.news.naver.com/mnews/article/448/0000440097?sid=104
